{
  "schemaVersion": "fs-0002/v1",
  "documentId": "doc-123",
  "documentVersionFingerprint": "sha256:9c4fe7a2b4e1",
  "producer": {
    "sourcePipeline": "document-compliance-evaluator",
    "serviceVersion": "2026.03.06",
    "tenantId": "tenant-001"
  },
  "evaluationRun": {
    "evaluationRunId": "run-20260306-001",
    "startedAt": "2026-03-06T09:15:00Z",
    "completedAt": "2026-03-06T09:15:12Z",
    "correlationId": "corr-12345"
  },
  "tasks": [
    {
      "taskId": "task-001",
      "logicalTaskKey": "uk-bim-001:clause-4.2:doc-123",
      "title": "Clarify employer information requirements",
      "description": "The document does not explicitly describe the employer information requirements required by the selected standard.",
      "severity": "high",
      "status": "open",
      "citation": {
        "text": "Employer information requirements shall be defined before delivery planning.",
        "referenceSource": "UK BIM Standard clause 4.2",
        "uri": "https://example.local/standards/uk-bim/4.2"
      },
      "anchor": {
        "anchorKind": "pageRegion",
        "selector": "page=3;x=0.15;y=0.32;w=0.55;h=0.08",
        "excerpt": "Project information requirements are outlined, but employer requirements are not clearly defined.",
        "confidence": 0.92,
        "lastValidatedAt": "2026-03-06T09:15:11Z",
        "extensions": {
          "pdf": {
            "pageNumber": 3
          }
        }
      },
      "provenance": {
        "sourcePipeline": "document-compliance-evaluator",
        "standardId": "UK-BIM",
        "clauseId": "4.2",
        "generatedAt": "2026-03-06T09:15:12Z"
      },
      "extensions": {
        "blocksuite": {
          "blockHint": "paragraph-17"
        }
      }
    }
  ]
}
